id_gen	symbol	log2FC_GCAt_vs_GCAn	adj-p-value_GCAt_vs_GCAn	log2FC_GNCAt_vs_GNCAn	adj-p-value_GNCAt_vs_GNCAn	vias_reactome	BP	MF	CC
ENSG00000114771	AADAC	-1.02914929967742	3.307588096709657e-11	-1.5772354722221973	1.0934450392092633e-18	Biological oxidations, Metabolism, Phase I - Functionalization of compounds	positive regulation of triglyceride catabolic process, lipid metabolic process, xenobiotic metabolic process	catalytic activity, deacetylase activity, triglyceride lipase activity, serine hydrolase activity, protein binding, lipase activity	endoplasmic reticulum membrane
ENSG00000141338	ABCA8	-1.077958394693547	5.004676143934495e-07	-0.6404364583333146	0.0012703885143766	ABC-family proteins mediated transport, Transport of small molecules	cholesterol transport, cholesterol efflux, regulation of cholesterol efflux, positive regulation of cholesterol efflux, lipid transport, xenobiotic transport, transmembrane transport, sphingomyelin biosynthetic process	ABC-type xenobiotic transporter activity, lipid transporter activity, ABC-type transporter activity, ATPase-coupled transmembrane transporter activity, ATP binding, ATP hydrolysis activity	intracellular membrane-bounded organelle, plasma membrane, endoplasmic reticulum, basolateral plasma membrane
ENSG00000075239	ACAT1	-1.055365365387097	1.3082286928750083e-20	-0.8154869027777512	7.291798692717032e-20	Utilization of Ketone Bodies, Metabolism, Synthesis of Ketone Bodies, Metabolism of amino acids and derivatives, Metabolism of lipids, Branched-chain amino acid catabolism, Ketone body metabolism	liver development, response to organic cyclic compound, coenzyme A biosynthetic process, acetyl-CoA biosynthetic process, acetyl-CoA catabolic process, ketone body metabolic process, ketone body catabolic process, metanephric proximal convoluted tubule development, response to hormone, coenzyme A metabolic process, adipose tissue development, fatty acid beta-oxidation, propionyl-CoA biosynthetic process, isoleucine catabolic process, response to starvation	acetyl-CoA C-acetyltransferase activity, enzyme binding, potassium ion binding, C-acetyltransferase activity, identical protein binding, coenzyme A binding, cholesterol O-acyltransferase activity	mitochondrial matrix, mitochondrion, extracellular exosome, endoplasmic reticulum
ENSG00000005187	ACSM3	-1.2907950934516077	8.476933336373324e-17	-1.3681564513888702	5.402539209412467e-22	Metabolism, mitochondrial fatty acid beta-oxidation of saturated fatty acids, Beta oxidation of butanoyl-CoA to acetyl-CoA, Fatty acid metabolism, Metabolism of lipids, Mitochondrial Fatty Acid Beta-Oxidation	cholesterol homeostasis, fatty acid biosynthetic process, regulation of blood pressure, acyl-CoA metabolic process	methylbutanoate-CoA ligase activity, fatty-acyl-CoA synthase activity, propionate CoA-transferase activity, metal ion binding, ATP binding, butyrate-CoA ligase activity, propionate-CoA ligase activity, fatty acid ligase activity	mitochondrial matrix, mitochondrion
ENSG00000196839	ADA	-1.1213138981048385	6.7853839297251284e-18	-1.2870300833333044	3.4229220425927346e-27	Metabolism, Purine salvage, Diseases of nucleotide metabolism, Diseases of metabolism, Drug ADME, Metabolism of nucleotides, Ribavirin ADME, Disease, Defective ADA disrupts (deoxy)adenosine deamination, Nucleotide salvage defects, Nucleotide salvage	germinal center B cell differentiation, T cell receptor signaling pathway, calcium-mediated signaling, trophectodermal cell differentiation, positive regulation of T cell receptor signaling pathway, xenobiotic metabolic process, amide catabolic process, positive regulation of germinal center formation, response to hypoxia, negative regulation of mucus secretion, xanthine biosynthetic process, response to inorganic substance, B cell proliferation, mature B cell apoptotic process, dAMP catabolic process, allantoin metabolic process, adenosine metabolic process, smooth muscle contraction, positive regulation of smooth muscle contraction, inosine biosynthetic process, germinal center formation, positive regulation of heart rate, negative regulation of thymocyte apoptotic process, GMP salvage, penile erection, hypoxanthine salvage, AMP catabolic process, cell adhesion, response to purine-containing compound, deoxyadenosine catabolic process, lung alveolus development, embryonic digestive tract development, leukocyte migration, placenta development, purine-containing compound salvage, adenosine catabolic process, T cell differentiation in thymus, negative regulation of mature B cell apoptotic process, mucus secretion, negative regulation of penile erection, alpha-beta T cell differentiation, positive regulation of T cell differentiation in thymus, positive regulation of alpha-beta T cell differentiation, negative regulation of leukocyte migration, Peyer's patch development, liver development, AMP salvage, thymocyte apoptotic process, positive regulation of calcium-mediated signaling, T cell activation, dATP catabolic process, negative regulation of inflammatory response, regulation of cell-cell adhesion mediated by integrin, negative regulation of adenosine receptor signaling pathway, purine nucleotide salvage, positive regulation of B cell proliferation	adenosine deaminase activity, deaminase activity, zinc ion binding, 2'-deoxyadenosine deaminase activity, protein binding	lysosome, cytosol, membrane, anchoring junction, external side of plasma membrane, cell surface, plasma membrane, cytoplasmic vesicle lumen
ENSG00000042980	ADAM28	-0.8359066868548384	2.025944525241437e-17	-1.2725052916666444	5.513177517978927e-29		spermatogenesis, proteolysis	metal ion binding, protein binding, metalloendopeptidase activity, metallopeptidase activity	mitochondrion, extracellular region, plasma membrane
ENSG00000187758	ADH1A	-0.1947491962258052	5.787244057989184e-05	-0.2677780833333196	6.338566684226422e-12	Abacavir metabolism, Metabolism, RA biosynthesis pathway, Signal Transduction, Biological oxidations, Phase I - Functionalization of compounds, Signaling by Retinoic Acid, Signaling by Nuclear Receptors, Drug ADME, Abacavir ADME, Ethanol oxidation	alcohol metabolic process, ethanol oxidation, retinol metabolic process, retinoic acid metabolic process	butanol dehydrogenase activity, zinc ion binding, alcohol dehydrogenase activity, zinc-dependent, NAD-retinol dehydrogenase activity, protein binding, alcohol dehydrogenase (NAD+) activity	cytosol, nucleoplasm, plasma membrane
ENSG00000196616	ADH1B	-1.3490184293225846	2.6668801928559275e-10	-0.9173401249999776	1.3903100624541672e-05	Biological oxidations, Ethanol oxidation, Metabolism, Phase I - Functionalization of compounds	retinoid metabolic process, ethanol oxidation, retinol metabolic process, retinoic acid metabolic process	NAD-retinol dehydrogenase activity, zinc ion binding, alcohol dehydrogenase activity, zinc-dependent	cytosol, nucleoplasm, plasma membrane
ENSG00000248144	ADH1C	-1.400395163645162	1.586230049742261e-11	-1.9157124583333245	7.135476957205535e-19	Metabolism, RA biosynthesis pathway, Signal Transduction, Biological oxidations, Phase I - Functionalization of compounds, Signaling by Retinoic Acid, Signaling by Nuclear Receptors, Ethanol oxidation	ethanol oxidation, retinol metabolic process, retinoic acid metabolic process	zinc ion binding, NAD-retinol dehydrogenase activity, alcohol dehydrogenase (NAD+) activity, alcohol dehydrogenase activity, zinc-dependent	cytosol, nucleoplasm, plasma membrane
ENSG00000198074	AKR1B10	-2.930860459645162	3.89269430376961e-15	-3.811453527777757	1.2259880541405731e-24	Metabolism, Visual phototransduction, Metabolism of vitamins and cofactors, Sensory Perception, Retinoid metabolism and transport, Metabolism of fat-soluble vitamins	cellular detoxification of aldehyde, retinoid metabolic process, farnesol catabolic process, doxorubicin metabolic process, daunorubicin metabolic process, retinol metabolic process	alditol:NADP+ 1-oxidoreductase activity, aldo-keto reductase (NADP) activity, geranylgeranyl reductase activity, alcohol dehydrogenase (NADP+) activity, NADP-retinol dehydrogenase activity, retinal dehydrogenase activity, indanol dehydrogenase activity, protein binding, allyl-alcohol dehydrogenase activity	lysosome, cytosol, mitochondrion, extracellular region
ENSG00000187134	AKR1C1	-1.093776944451614	4.94170086280135e-13	-1.3598458194444056	1.9962103961270856e-17	Metabolism, Visual phototransduction, Synthesis of bile acids and bile salts via 24-hydroxycholesterol, Synthesis of bile acids and bile salts, Metabolism of vitamins and cofactors, Sensory Perception, Prednisone ADME, Synthesis of bile acids and bile salts via 27-hydroxycholesterol, Metabolism of steroids, Synthesis of bile acids and bile salts via 7alpha-hydroxycholesterol, Drug ADME, Metabolism of lipids, Bile acid and bile salt metabolism, Retinoid metabolism and transport, Metabolism of fat-soluble vitamins	cellular response to jasmonic acid stimulus, retinoid metabolic process, digestion, bile acid metabolic process, xenobiotic metabolic process, progesterone metabolic process, positive regulation of reactive oxygen species metabolic process, response to organophosphorus, retinal metabolic process, intestinal cholesterol absorption, epithelial cell differentiation, doxorubicin metabolic process, bile acid and bile salt transport, cholesterol homeostasis, prostaglandin metabolic process, daunorubicin metabolic process	steroid dehydrogenase activity, acting on the CH-OH group of donors, NAD or NADP as acceptor, testosterone dehydrogenase [NAD(P)] activity, dihydrotestosterone 17-beta-dehydrogenase activity, androsterone dehydrogenase activity, indanol dehydrogenase activity, 3beta-hydroxy-5beta-steroid dehydrogenase activity, carboxylic acid binding, oxidoreductase activity, acting on NAD(P)H, quinone or similar compound as acceptor, ketosteroid monooxygenase activity, 17-alpha,20-alpha-dihydroxypregn-4-en-3-one dehydrogenase activity, aldo-keto reductase (NADP) activity, androstan-3-alpha,17-beta-diol dehydrogenase activity, alditol:NADP+ 1-oxidoreductase activity, phenanthrene 9,10-monooxygenase activity, trans-1,2-dihydrobenzene-1,2-diol dehydrogenase activity, protein binding, testosterone 17-beta-dehydrogenase (NADP+) activity, androsterone dehydrogenase (B-specific) activity, bile acid binding, 5alpha-androstane-3beta,17beta-diol dehydrogenase activity, estradiol 17-beta-dehydrogenase [NAD(P)] activity	cytosol, extracellular exosome
ENSG00000151632	AKR1C2	-1.093776944451614	4.94170086280135e-13	-1.3598458194444056	1.9962103961270856e-17	Metabolism, Synthesis of bile acids and bile salts via 24-hydroxycholesterol, Synthesis of bile acids and bile salts, Synthesis of bile acids and bile salts via 27-hydroxycholesterol, Synthesis of bile acids and bile salts via 7alpha-hydroxycholesterol, Metabolism of lipids, Bile acid and bile salt metabolism, Metabolism of steroids	cellular response to jasmonic acid stimulus, digestion, daunorubicin metabolic process, steroid metabolic process, cellular response to prostaglandin D stimulus, progesterone metabolic process, epithelial cell differentiation, doxorubicin metabolic process, positive regulation of protein kinase B signaling, prostaglandin metabolic process, positive regulation of cell population proliferation, G protein-coupled receptor signaling pathway	carboxylic acid binding, androstan-3-alpha,17-beta-diol dehydrogenase activity, alditol:NADP+ 1-oxidoreductase activity, oxidoreductase activity, acting on NAD(P)H, quinone or similar compound as acceptor, bile acid binding, phenanthrene 9,10-monooxygenase activity, ketosteroid monooxygenase activity, indanol dehydrogenase activity, androsterone dehydrogenase activity, trans-1,2-dihydrobenzene-1,2-diol dehydrogenase activity, estradiol 17-beta-dehydrogenase [NAD(P)] activity	
ENSG00000196139	AKR1C3	-0.8993630865806495	0.0003935065914871	-1.543208305555515	1.3324854815513092e-10	Visual phototransduction, Synthesis of bile acids and bile salts, Retinoid metabolism and transport, Arachidonic acid metabolism, RA biosynthesis pathway, Signaling by Nuclear Receptors, Synthesis of bile acids and bile salts via 27-hydroxycholesterol, Synthesis of bile acids and bile salts via 7alpha-hydroxycholesterol, Bile acid and bile salt metabolism, Metabolism of steroids, Metabolism of fat-soluble vitamins, Signal Transduction, Metabolism of vitamins and cofactors, Synthesis of Prostaglandins (PG) and Thromboxanes (TX), Sensory Perception, Metabolism of lipids, Metabolism, Synthesis of bile acids and bile salts via 24-hydroxycholesterol, Signaling by Retinoic Acid, Fatty acid metabolism	retinoid metabolic process, farnesol catabolic process, doxorubicin metabolic process, prostaglandin metabolic process, daunorubicin metabolic process, retinol metabolic process, macromolecule metabolic process, keratinocyte differentiation, negative regulation of retinoic acid biosynthetic process, steroid metabolic process, cyclooxygenase pathway, cellular response to jasmonic acid stimulus, positive regulation of cell population proliferation, cellular response to calcium ion, regulation of testosterone biosynthetic process, progesterone metabolic process, positive regulation of reactive oxygen species metabolic process, regulation of retinoic acid receptor signaling pathway, retinal metabolic process, cellular response to prostaglandin stimulus, positive regulation of protein kinase B signaling, G protein-coupled receptor signaling pathway, cellular response to starvation, cellular response to prostaglandin D stimulus, positive regulation of endothelial cell apoptotic process, cellular response to corticosteroid stimulus, response to nutrient, renal absorption, testosterone biosynthetic process, male gonad development	dihydrotestosterone 17-beta-dehydrogenase activity, NADP-retinol dehydrogenase activity, NAD-retinol dehydrogenase activity, retinal dehydrogenase activity, androsterone dehydrogenase activity, delta4-3-oxosteroid 5beta-reductase activity, 15-hydroxyprostaglandin-D dehydrogenase (NADP+) activity, oxidoreductase activity, acting on NAD(P)H, quinone or similar compound as acceptor, geranylgeranyl reductase activity, ketosteroid monooxygenase activity, aldo-keto reductase (NADP) activity, testosterone dehydrogenase (NAD+) activity, androstan-3-alpha,17-beta-diol dehydrogenase activity, alditol:NADP+ 1-oxidoreductase activity, phenanthrene 9,10-monooxygenase activity, prostaglandin H2 endoperoxidase reductase activity, prostaglandin D2 11-ketoreductase activity, testosterone 17-beta-dehydrogenase (NADP+) activity, bile acid binding, ketoreductase activity, prostaglandin-F synthase activity, 5alpha-androstane-3beta,17beta-diol dehydrogenase activity, estradiol 17-beta-dehydrogenase [NAD(P)] activity	cytoplasm, cytosol, extracellular exosome, nucleus
ENSG00000162482	AKR7A3	-1.7614637136612892	7.8139348646393345e-19	-2.014799986111077	6.7431850533926635e-40	Biological oxidations, Metabolism, Aflatoxin activation and detoxification	cellular aldehyde metabolic process, electron transport chain	aldo-keto reductase (NADP) activity, protein binding, electron transfer activity, identical protein binding	cytosol, extracellular exosome, Golgi apparatus, cytoplasm
ENSG00000165092	ALDH1A1	-1.7249776175806488	8.597875681619297e-13	-2.2773349305555275	1.514483777695504e-21	Metabolism, RA biosynthesis pathway, Metabolism of carbohydrates, Signal Transduction, Biological oxidations, Phase I - Functionalization of compounds, Signaling by Retinoic Acid, Signaling by Nuclear Receptors, Fructose catabolism, Ethanol oxidation, Fructose metabolism	negative regulation of cold-induced thermogenesis, maintenance of lens transparency, gamma-aminobutyric acid biosynthetic process, retinoid metabolic process, fructosamine catabolic process, cellular aldehyde metabolic process, cellular detoxification of aldehyde, retinol metabolic process	benzaldehyde dehydrogenase (NAD+) activity, androgen binding, NAD binding, aminobutyraldehyde dehydrogenase activity, aldehyde dehydrogenase (NAD+) activity, GTPase activator activity, glyceraldehyde-3-phosphate dehydrogenase (NAD+) (non-phosphorylating) activity, 3-deoxyglucosone dehydrogenase activity, retinal dehydrogenase activity, protein binding	cytosol, synapse, extracellular exosome, axon, cytoplasm
ENSG00000108602	ALDH3A1	-1.764952808983872	5.323630375637078e-16	-2.4520137777777533	7.61834477591004e-33	Biological oxidations, Metabolism, Phase I - Functionalization of compounds	lipid metabolic process, cellular aldehyde metabolic process, xenobiotic metabolic process	benzaldehyde dehydrogenase (NAD+) activity, aldehyde dehydrogenase [NAD(P)+] activity, 3-chloroallyl aldehyde dehydrogenase activity, aldehyde dehydrogenase (NAD+) activity, alcohol dehydrogenase (NADP+) activity, protein binding	cytosol, endoplasmic reticulum, plasma membrane, extracellular space, cytoplasm
ENSG00000119711	ALDH6A1	-1.769986843677418	3.1113664114504784e-31	-1.6356007361110816	3.757233596638559e-31	Metabolism, Metabolism of amino acids and derivatives, Branched-chain amino acid catabolism	brown fat cell differentiation, branched-chain amino acid catabolic process, valine catabolic process, valine metabolic process, thymine metabolic process, thymine catabolic process	fatty-acyl-CoA binding, methylmalonate-semialdehyde dehydrogenase (acylating) activity, malonate-semialdehyde dehydrogenase (acetylating) activity, malonate-semialdehyde dehydrogenase (acetylating, NAD+) activity, RNA binding	nucleoplasm, mitochondrion, mitochondrial matrix
ENSG00000136872	ALDOB	-0.7924969946048366	0.0033589856258269	-1.2348586388888707	2.5487763398672674e-05	Glucose metabolism, Diseases of carbohydrate metabolism, Metabolism, Hereditary fructose intolerance, Fructose catabolism, Metabolism of carbohydrates, Gluconeogenesis, Glycolysis, Diseases of metabolism, Disease, Fructose metabolism	fructose metabolic process, NADH oxidation, glycolytic process, vacuolar proton-transporting V-type ATPase complex assembly, positive regulation of ATP-dependent activity, fructose catabolic process to hydroxyacetone phosphate and glyceraldehyde-3-phosphate, negative regulation of pentose-phosphate shunt, fructose 1,6-bisphosphate metabolic process	cytoskeletal protein binding, fructose-1-phosphate aldolase activity, ATPase binding, fructose binding, identical protein binding, molecular adaptor activity, fructose-bisphosphate aldolase activity, protein binding	cytosol, centriolar satellite, extracellular exosome, microtubule organizing center
ENSG00000109511	ANXA10	-3.342817069177425	4.456715064657048e-21	-3.3774372361110867	2.019520355690484e-24			calcium-dependent phospholipid binding, calcium ion binding, protein binding	
ENSG00000105290	APLP1	-1.3727109768548402	3.503981763154508e-21	-1.3463744999999756	2.3073198755804245e-23		endocytosis, cell adhesion, animal organ morphogenesis, forebrain development, nervous system development, negative regulation of adenylate cyclase-activating G protein-coupled receptor signaling pathway, axonogenesis, extracellular matrix organization, apoptotic process, cytoplasmic polyadenylation, central nervous system development, cellular response to norepinephrine stimulus, regulation of translation	heparin binding, identical protein binding, alpha-2B adrenergic receptor binding, alpha-2A adrenergic receptor binding, alpha-2C adrenergic receptor binding, transition metal ion binding, protein binding	basement membrane, nucleoplasm, perinuclear region of cytoplasm, plasma membrane, Golgi apparatus
ENSG00000179674	ARL14	-0.8428695850967731	0.0002337812939489	-1.700211777777758	7.14269976789588e-16		vesicle-mediated transport, intracellular protein transport	GTP binding, protein binding, GTPase activity	cytoplasmic vesicle, cytoplasm
ENSG00000143153	ATP1B1	-0.4716301876854789	0.0010581644526716	-0.8546469374999734	1.9015139022544632e-08	Viral Infection Pathways, SARS-CoV Infections, Potential therapeutics for SARS, Cardiac conduction, Ion transport by P-type ATPases, Ion channel transport, Basigin interactions, Muscle contraction, Ion homeostasis, Infectious disease, Transport of small molecules, Disease, Cell surface interactions at the vascular wall, Hemostasis	regulation of cardiac muscle contraction by calcium ion signaling, sodium ion transmembrane transport, innate immune response, potassium ion import across plasma membrane, positive regulation of ATP-dependent activity, regulation of gene expression, positive regulation of calcium:sodium antiporter activity, positive regulation of P-type sodium:potassium-exchanging transporter activity, positive regulation of potassium ion transmembrane transporter activity, ATP metabolic process, relaxation of cardiac muscle, establishment or maintenance of transmembrane electrochemical gradient, protein transport into plasma membrane raft, positive regulation of potassium ion import across plasma membrane, cardiac muscle contraction, cell adhesion, protein stabilization, intracellular sodium ion homeostasis, sodium ion export across plasma membrane, intracellular calcium ion homeostasis, protein localization to plasma membrane, intracellular potassium ion homeostasis, cell communication by electrical coupling involved in cardiac conduction, proton transmembrane transport, monoatomic cation transmembrane transport, membrane repolarization during cardiac muscle cell action potential, positive regulation of sodium ion export across plasma membrane, membrane repolarization	protein-macromolecule adaptor activity, MHC class II protein complex binding, ATPase binding, ATPase activator activity, protein heterodimerization activity, protein kinase binding, protein binding	sperm flagellum, extracellular exosome, organelle membrane, sodium:potassium-exchanging ATPase complex, membrane, basolateral plasma membrane, extracellular vesicle, lateral plasma membrane, sarcolemma, plasma membrane, T-tubule, intercalated disc, apical plasma membrane
ENSG00000105675	ATP4A	-5.018923723935487	9.177812190209512e-32	-5.3798212083333175	2.899110684807784e-46	Ion channel transport, Ion transport by P-type ATPases, Transport of small molecules	intracellular potassium ion homeostasis, monoatomic ion transmembrane transport, proton transmembrane transport, regulation of proton transport, intracellular sodium ion homeostasis, response to xenobiotic stimulus, potassium ion import across plasma membrane, pH reduction, establishment or maintenance of transmembrane electrochemical gradient, sodium ion export across plasma membrane	P-type sodium:potassium-exchanging transporter activity, P-type potassium:proton transporter activity, potassium ion binding, magnesium ion binding, ATP binding, ATP hydrolysis activity	apical plasma membrane, plasma membrane, extracellular space
ENSG00000186009	ATP4B	-5.870818032612897	2.046899359862088e-33	-6.211194888888867	3.1072004092036364e-48	Ion channel transport, Ion transport by P-type ATPases, Transport of small molecules	intracellular potassium ion homeostasis, proton transmembrane transport, cell adhesion, intracellular sodium ion homeostasis, potassium ion import across plasma membrane, response to organonitrogen compound, pH reduction, response to lipopolysaccharide, sodium ion export across plasma membrane	ATPase activator activity, P-type potassium:proton transporter activity, heterocyclic compound binding, protein binding	apical plasma membrane, sodium:potassium-exchanging ATPase complex, plasma membrane
ENSG00000160862	AZGP1	-1.974961091475806	1.095780299491926e-14	-2.3004695277777643	7.103998829348277e-28	Miscellaneous transport and binding events, Transport of small molecules	cell adhesion, negative regulation of cell population proliferation, retina homeostasis, protein transmembrane transport, detection of chemical stimulus involved in sensory perception of bitter taste, immune response	protein transmembrane transporter activity, RNA nuclease activity, protein binding	collagen-containing extracellular matrix, extracellular exosome, nucleus, extracellular region, external side of plasma membrane, extracellular space
ENSG00000109956	B3GAT1	-1.0916197327258068	6.510105921993897e-20	-0.9674031111110972	5.7518153281311645e-24	Heparan sulfate/heparin (HS-GAG) metabolism, Metabolism, Metabolism of carbohydrates, A tetrasaccharide linker sequence is required for GAG synthesis, Glycosaminoglycan metabolism, Chondroitin sulfate/dermatan sulfate metabolism	visual learning, glycosaminoglycan biosynthetic process, carbohydrate metabolic process, protein glycosylation, chondroitin sulfate proteoglycan biosynthetic process	metal ion binding, galactosylgalactosylxylosylprotein 3-beta-glucuronosyltransferase activity, protein binding	membrane, extracellular region, intracellular membrane-bounded organelle, Golgi membrane, endoplasmic reticulum membrane
ENSG00000064787	BCAS1	-0.6876325869354858	2.6779466125468083e-08	-1.16621913888887	2.392004353109127e-22		myelination		extracellular exosome, cytoplasm
ENSG00000182795	C1orf116	-0.6524172579112912	9.652133735247374e-06	-1.055297368055525	2.9452864690432903e-17			molecular_function, protein binding	extracellular exosome, cytosol, plasma membrane, cytoplasm
