id_gen	symbol	log2FC_GCAt_vs_GCAn	adj-p-value_GCAt_vs_GCAn	log2FC_GNCAt_vs_GNCAn	adj-p-value_GNCAt_vs_GNCAn	vias_reactome	BP	MF	CC
ENSG00000189221	MAOA	-0.7226098868548387	1.4437594564176596e-12	-0.7211975972221936	1.7363504364086772e-13	Norepinephrine Neurotransmitter Release Cycle, Enzymatic degradation of dopamine by COMT, Amine Oxidase reactions, Biological oxidations, Serotonin clearance from the synaptic cleft, Immune System, Neuronal System, Signaling by Interleukins, Defective MAOA causes BRUNS, Neurotransmitter clearance, Metabolic disorders of biological oxidation enzymes, Interleukin-4 and Interleukin-13 signaling, Dopamine clearance from the synaptic cleft, Diseases of metabolism, Transmission across Chemical Synapses, Disease, Neurotransmitter release cycle, Enzymatic degradation of Dopamine by monoamine oxidase, Metabolism, Phase I - Functionalization of compounds, Metabolism of serotonin, Cytokine Signaling in Immune system, Biogenic amines are oxidatively deaminated to aldehydes by MAOA and MAOB	biogenic amine metabolic process, neurotransmitter catabolic process, dopamine catabolic process, positive regulation of signal transduction	monoamine oxidase activity, aliphatic amine oxidase activity, phenethylamine:oxygen oxidoreductase (deaminating) activity, primary amine oxidase activity, flavin adenine dinucleotide binding, protein binding	mitochondrial outer membrane, mitochondrion, cytosol
ENSG00000100139	MICALL1	-0.9566075279999956	1.333076724332867e-25	-0.8747798819444217	1.0646791894668671e-27		plasma membrane tubulation, protein targeting to membrane, endocytosis, receptor-mediated endocytosis, slow endocytic recycling, endocytic recycling, neuron projection development, protein localization to endosome	small GTPase binding, identical protein binding, metal ion binding, cadherin binding, protein binding, phosphatidic acid binding	late endosome membrane, cytoplasmic side of endosome membrane, late endosome, recycling endosome membrane, trans-Golgi network, early endosome
ENSG00000115648	MLPH	-0.8465186040806447	7.855218930735854e-07	-1.3729060694444168	1.6250827684246034e-19		melanosome transport, intracellular protein transport	small GTPase binding, protein-macromolecule adaptor activity, myosin binding, actin binding, metal ion binding, protein binding	dendrite, cortical actin cytoskeleton, extracellular exosome, perinuclear region of cytoplasm
ENSG00000263639	MSMB	-0.7743588191370963	0.0053614982490007	-1.812522270833316	3.614954837334737e-09			molecular_function, protein binding	extracellular space, nucleus
ENSG00000169715	MT1E	-2.105821261870972	4.391918160686284e-29	-1.6134794305555271	3.2355976746180193e-26	Metallothioneins bind metals, Response to metal ions, Cellular responses to stimuli	detoxification of copper ion, cellular response to cadmium ion, negative regulation of growth, cellular response to zinc ion, cellular response to copper ion, intracellular zinc ion homeostasis	metal ion binding, protein binding, zinc ion binding	cytoplasm, nucleus
ENSG00000198417	MT1F	-2.511449379274195	3.580513461557011e-27	-2.022926055555523	1.7305003878304283e-30	Metallothioneins bind metals, Response to metal ions, Cellular responses to stimuli	detoxification of copper ion, cellular response to cadmium ion, negative regulation of growth, cellular response to zinc ion, cellular response to copper ion, intracellular zinc ion homeostasis	metal ion binding, protein binding, zinc ion binding	cytoplasm, nucleus
ENSG00000125144	MT1G	-2.7055632592903223	1.4927063262890044e-29	-2.0361390972221898	4.040134194721226e-27	Metallothioneins bind metals, Response to metal ions, Cellular responses to stimuli	detoxification of copper ion, monocyte differentiation, negative regulation of growth, cellular response to cadmium ion, cellular response to zinc ion, cellular response to vascular endothelial growth factor stimulus, monocyte activation, cellular response to copper ion, intracellular zinc ion homeostasis	metal ion binding, protein binding, zinc ion binding	cytoplasm, nucleus
ENSG00000205358	MT1H	-2.029273018556454	6.724248455727456e-29	-1.4838555763888532	7.317279990757282e-25	Metallothioneins bind metals, Response to metal ions, Cellular responses to stimuli	detoxification of copper ion, cellular response to cadmium ion, negative regulation of growth, cellular response to zinc ion, cellular response to copper ion, intracellular zinc ion homeostasis	metal ion binding, protein binding, zinc ion binding	cytoplasm, nucleus
ENSG00000205364	MT1M	-3.7156801534032224	2.046899359862088e-33	-2.758381749999983	3.479310619078892e-28	Metallothioneins bind metals, Response to metal ions, Cellular responses to stimuli	detoxification of copper ion, cellular response to cadmium ion, negative regulation of growth, cellular response to zinc ion, cellular response to copper ion, intracellular zinc ion homeostasis	metal ion binding, protein binding, zinc ion binding	cytoplasm, nucleus
ENSG00000187193	MT1X	-2.3298847462096752	2.02992436426e-30	-1.6294819999999677	1.5906614439293658e-22	Metallothioneins bind metals, Response to metal ions, Cellular responses to stimuli	cellular response to erythropoietin, detoxification of copper ion, cellular response to cadmium ion, negative regulation of growth, cellular response to zinc ion, response to metal ion, cellular response to copper ion, intracellular zinc ion homeostasis	metal ion binding, protein binding, zinc ion binding	cytoplasm, nucleus
ENSG00000125148	MT2A	-1.7573237927419392	2.576614059768794e-28	-1.2375853472221865	1.7415123016482602e-20	Interferon Signaling, Cellular responses to stimuli, Immune System, Cytokine Signaling in Immune system, Metallothioneins bind metals, Interferon gamma signaling, Response to metal ions	cellular response to interleukin-3, intracellular copper ion homeostasis, cellular response to erythropoietin, detoxification of copper ion, cellular response to cadmium ion, negative regulation of growth, cellular response to zinc ion, cellular response to copper ion, intracellular zinc ion homeostasis	metal ion binding, protein binding, zinc ion binding	cytoplasm, cytosol, nucleus
ENSG00000185499	MUC1	-0.8749074405806443	0.0007410567346342	-1.2349797777777507	2.018684658504081e-09	Metabolism of proteins, Diseases of glycosylation, Immune System, Signaling by Interleukins, Interleukin-4 and Interleukin-13 signaling, Innate Immune System, O-linked glycosylation, Defective GALNT12 causes CRCS1, Dectin-2 family, Diseases of metabolism, C-type lectin receptors (CLRs), Disease, Defective GALNT3 causes HFTC, Defective C1GALT1C1 causes TNPS, O-linked glycosylation of mucins, Post-translational protein modification, Cytokine Signaling in Immune system, Termination of O-glycan biosynthesis, Diseases associated with O-glycosylation of proteins	negative regulation of cell adhesion mediated by integrin, DNA damage response, signal transduction by p53 class mediator resulting in transcription of p21 class mediator, positive regulation of transcription from RNA polymerase II promoter in response to stress, DNA-templated transcription, regulation of transcription from RNA polymerase II promoter in response to stress, DNA damage response, signal transduction by p53 class mediator resulting in cell cycle arrest, localization, negative regulation of transcription by competitive promoter binding, negative regulation of intrinsic apoptotic signaling pathway in response to DNA damage by p53 class mediator, positive regulation of histone H4 acetylation	RNA polymerase II cis-regulatory region sequence-specific DNA binding, p53 binding, transcription coregulator activity, protein binding	Golgi lumen, extracellular exosome, nucleus, chromatin, plasma membrane, vesicle, apical plasma membrane, extracellular space
ENSG00000215182	MUC5AC	-2.8763235572258044	8.2900616674352705e-19	-3.3466952361110813	3.858029836775485e-26	Defective GALNT3 causes HFTC, Innate Immune System, O-linked glycosylation, Defective C1GALT1C1 causes TNPS, Defective GALNT12 causes CRCS1, Metabolism of proteins, Dectin-2 family, Diseases of glycosylation, O-linked glycosylation of mucins, Immune System, Diseases of metabolism, Post-translational protein modification, Termination of O-glycan biosynthesis, Diseases associated with O-glycosylation of proteins, C-type lectin receptors (CLRs), Disease		metal ion binding, extracellular matrix structural constituent	mucus layer, Golgi lumen, extracellular exosome, extracellular matrix, plasma membrane, extracellular space, cytoplasm
ENSG00000184956	MUC6	-1.8855095945483853	5.506841063667057e-20	-2.1554447361110887	4.0838622737991938e-25	Defective GALNT3 causes HFTC, Innate Immune System, O-linked glycosylation, Defective C1GALT1C1 causes TNPS, Defective GALNT12 causes CRCS1, Metabolism of proteins, Dectin-2 family, Diseases of glycosylation, O-linked glycosylation of mucins, Immune System, Diseases of metabolism, Post-translational protein modification, Termination of O-glycan biosynthesis, Diseases associated with O-glycosylation of proteins, C-type lectin receptors (CLRs), Disease			extracellular matrix, Golgi lumen, plasma membrane, extracellular space
ENSG00000034971	MYOC	-1.2524302549838735	4.8373873431615796e-11	-1.195602472222193	1.5332620848871428e-20		signal transduction, clustering of voltage-gated sodium channels, positive regulation of substrate adhesion-dependent cell spreading, negative regulation of Rho protein signal transduction, myelination in peripheral nervous system, positive regulation of phosphatidylinositol 3-kinase signaling, positive regulation of mitochondrial depolarization, skeletal muscle hypertrophy, osteoblast differentiation, positive regulation of cell migration, regulation of MAPK cascade, positive regulation of focal adhesion assembly, neuron projection development, positive regulation of protein kinase B signaling, positive regulation of stress fiber assembly, non-canonical Wnt signaling pathway via JNK cascade, negative regulation of stress fiber assembly, ERBB2-ERBB3 signaling pathway, bone development, negative regulation of cell-matrix adhesion	fibronectin binding, metal ion binding, frizzled binding, myosin light chain binding, protein binding, receptor tyrosine kinase binding	mitochondrial outer membrane, node of Ranvier, collagen-containing extracellular matrix, extracellular exosome, cilium, mitochondrial intermembrane space, endoplasmic reticulum, cytoplasmic vesicle, rough endoplasmic reticulum, Golgi apparatus, mitochondrial inner membrane, extracellular space
ENSG00000149294	NCAM1	-0.3670260867258061	6.223198220910422e-16	-0.2594346805555396	2.813779146937572e-11	Signal transduction by L1, Interferon Signaling, NCAM1 interactions, Nervous system development, MAPK family signaling cascades, Signal Transduction, Axon guidance, Extracellular matrix organization, Developmental Biology, Immune System, Cytokine Signaling in Immune system, L1CAM interactions, NCAM signaling for neurite out-growth, Interferon gamma signaling, RAF/MAP kinase cascade, MAPK1/MAPK3 signaling, ECM proteoglycans	cell adhesion, regulation of semaphorin-plexin signaling pathway, commissural neuron axon guidance, epithelial to mesenchymal transition, viral entry into host cell	protein binding, virus receptor activity	cytosol, collagen-containing extracellular matrix, membrane, extracellular region, external side of plasma membrane, cell surface, plasma membrane, Golgi membrane
ENSG00000049759	NEDD4L	-0.9172207929999994	1.0174583888775082e-17	-0.8593256458333052	5.5513515012504616e-21	Viral Infection Pathways, Budding and maturation of HIV virion, Immune System, Generic Transcription Pathway, Adaptive Immune System, Signaling by TGF-beta Receptor Complex, Gene expression (Transcription), Downregulation of SMAD2/3:SMAD4 transcriptional activity, Signaling by TGFB family members, Ion channel transport, HIV Life Cycle, RNA Polymerase II Transcription, Late Phase of HIV Life Cycle, Class I MHC mediated antigen processing & presentation, Signal Transduction, Downregulation of TGF-beta receptor signaling, Transcriptional activity of SMAD2/SMAD3:SMAD4 heterotrimer, HIV Infection, TGF-beta receptor signaling activates SMADs, Disease, Antigen processing: Ubiquitination & Proteasome degradation, Infectious disease, Transport of small molecules, Stimuli-sensing channels	negative regulation of protein localization to cell surface, regulation of membrane repolarization, positive regulation of dendrite extension, proteasome-mediated ubiquitin-dependent protein catabolic process, cell differentiation, regulation of membrane potential, ventricular cardiac muscle cell action potential, positive regulation of protein catabolic process, regulation of protein stability, negative regulation of sodium ion transmembrane transport, protein ubiquitination, regulation of membrane depolarization, regulation of monoatomic ion transmembrane transport, regulation of sodium ion transmembrane transport, negative regulation of sodium ion transmembrane transporter activity, regulation of potassium ion transmembrane transporter activity, monoatomic ion transmembrane transport, protein K48-linked ubiquitination, negative regulation of potassium ion transmembrane transport, positive regulation of caveolin-mediated endocytosis, regulation of dendrite morphogenesis, negative regulation of potassium ion transmembrane transporter activity, ubiquitin-dependent protein catabolic process, protein monoubiquitination	potassium channel inhibitor activity, transmembrane transporter binding, sodium channel regulator activity, ubiquitin-protein transferase activity, ubiquitin protein ligase activity, protein binding, sodium channel inhibitor activity, potassium channel regulator activity	cytosol, extracellular exosome, nucleoplasm, multivesicular body, plasma membrane, Golgi apparatus, cytoplasm
ENSG00000181019	NQO1	-0.7302177490322563	0.0001109241231408	-1.3022130694444147	2.741801827350762e-13	Regulation of ornithine decarboxylase (ODC), Metabolism, Cellular responses to stimuli, Nuclear events mediated by NFE2L2, Cellular responses to stress, KEAP1-NFE2L2 pathway, Cellular response to chemical stress, Metabolism of amino acids and derivatives, Metabolism of polyamines, NFE2L2 regulating anti-oxidant/detoxification enzymes	innate immune response, response to oxidative stress, negative regulation of catalytic activity, xenobiotic metabolic process, cell redox homeostasis, response to tetrachloromethane, response to estradiol, ubiquinone metabolic process, vitamin K metabolic process, response to L-glutamine, negative regulation of protein catabolic process, response to lipopolysaccharide, response to testosterone, response to toxic substance, negative regulation of apoptotic process, response to hydrogen sulfide, response to amine, positive regulation of neuron apoptotic process, response to flavonoid, vitamin E metabolic process, response to carbohydrate, removal of superoxide radicals, cellular response to metal ion, NADPH oxidation, cellular response to hydrogen peroxide, response to ischemia, protein polyubiquitination, NADH oxidation, response to electrical stimulus, response to nutrient, response to hormone, response to ethanol, protein catabolic process, nitric oxide biosynthetic process, cellular response to oxidative stress, synaptic transmission, cholinergic, response to alkaloid	NADPH dehydrogenase (quinone) activity, NAD(P)H dehydrogenase (quinone) activity, NADH dehydrogenase (quinone) activity, RNA binding, identical protein binding, protein binding, cytochrome-b5 reductase activity, acting on NAD(P)H, superoxide dismutase activity	cytosol, synapse, nucleus, dendrite, neuronal cell body, cytoplasm
ENSG00000070081	NUCB2	-1.0654644205483894	5.435178121939799e-14	-0.6743793611110904	7.4269733856772e-10			G-protein alpha-subunit binding, DNA binding, guanyl-nucleotide exchange factor activity, calcium ion binding, protein binding	cytosol, extracellular exosome, endoplasmic reticulum, nuclear envelope, plasma membrane, Golgi apparatus, endoplasmic reticulum-Golgi intermediate compartment, extracellular space
ENSG00000229314	ORM1	-0.8798311682499991	1.5033255235151658e-11	-0.8361680347222089	8.963276578516524e-07	Hemostasis, Innate Immune System, Platelet degranulation , Immune System, Platelet activation, signaling and aggregation, Response to elevated platelet cytosolic Ca2+, Neutrophil degranulation	inflammatory response, acute-phase response, regulation of immune system process, negative regulation of interleukin-6 production, negative regulation of tumor necrosis factor production, positive regulation of tumor necrosis factor production, positive regulation of interleukin-1 production, positive regulation of interleukin-1 beta production		collagen-containing extracellular matrix, extracellular exosome, platelet alpha granule lumen, blood microparticle, extracellular region, specific granule lumen, tertiary granule lumen, extracellular space
ENSG00000228278	ORM2	-0.9854233770322568	1.668712973183095e-13	-0.95590293749998	7.703100599210994e-10	Hemostasis, Innate Immune System, Platelet degranulation , Immune System, Platelet activation, signaling and aggregation, Response to elevated platelet cytosolic Ca2+, Neutrophil degranulation	acute-phase response, regulation of immune system process, positive regulation of tumor necrosis factor production, positive regulation of interleukin-1 production, positive regulation of interleukin-1 beta production		collagen-containing extracellular matrix, azurophil granule lumen, extracellular exosome, platelet alpha granule lumen, blood microparticle, extracellular region, specific granule lumen, extracellular space
ENSG00000174944	P2RY14	-1.391496560338707	1.965486694931462e-09	-1.0530099027777569	3.742930405115665e-13	Class A/1 (Rhodopsin-like receptors), G alpha (i) signalling events, P2Y receptors, GPCR downstream signalling, Signal Transduction, Signaling by GPCR, Nucleotide-like (purinergic) receptors, GPCR ligand binding	G protein-coupled purinergic nucleotide receptor signaling pathway, G protein-coupled receptor signaling pathway	G protein-coupled UDP receptor activity, G protein-coupled purinergic nucleotide receptor activity	membrane, plasma membrane
ENSG00000108187	PBLD	-1.5903347423548366	3.6315646570639245e-14	-1.9761089027777547	2.02529658220468e-25		negative regulation of transforming growth factor beta receptor signaling pathway, negative regulation of SMAD protein signal transduction, biosynthetic process, maintenance of gastrointestinal epithelium	molecular_function, protein binding, isomerase activity, identical protein binding	extracellular exosome, cytoplasm
ENSG00000184226	PCDH9	-0.5441468438145138	3.9523294030263267e-11	-0.1881043611110948	0.052315753678646		forebrain development, cell adhesion, homophilic cell adhesion via plasma membrane adhesion molecules		growth cone, plasma membrane, cell-cell contact zone
ENSG00000170962	PDGFD	-1.1615993059354812	1.9962129034310413e-17	-1.185888333333307	1.125720645013416e-14	Signaling by Receptor Tyrosine Kinases, Signal Transduction, Signaling by PDGF	positive regulation of monocyte extravasation, cellular response to amino acid stimulus, positive regulation of smooth muscle cell chemotaxis, platelet-derived growth factor receptor signaling pathway, positive regulation of MAP kinase activity, cellular response to transforming growth factor beta stimulus, positive regulation of cell migration, positive regulation of glomerular mesangial cell proliferation, positive regulation of cell division, cellular response to platelet-derived growth factor stimulus, positive regulation of phosphatidylinositol 3-kinase signaling, positive regulation of protein autophosphorylation, positive regulation of smooth muscle cell proliferation, positive regulation of fibroblast proliferation, positive regulation of cell population proliferation, regulation of peptidyl-tyrosine phosphorylation, positive regulation of ERK1 and ERK2 cascade, cellular response to hydrogen peroxide	platelet-derived growth factor receptor binding, growth factor activity	Golgi membrane, extracellular region, endoplasmic reticulum lumen, extracellular space
ENSG00000185615	PDIA2	-1.9703106713709675	3.108531680936845e-18	-2.0897550138888707	1.1313615141120973e-29		response to endoplasmic reticulum stress, platelet aggregation, protein retention in ER lumen, protein folding in endoplasmic reticulum, protein folding	protein disulfide isomerase activity, steroid binding, protein binding, disulfide oxidoreductase activity, protein-disulfide reductase activity	endoplasmic reticulum lumen, endoplasmic reticulum
ENSG00000229859	PGA3	-4.987947808370965	8.47847630025087e-28	-4.195347083333308	1.6598621960948458e-31	Metabolism of proteins, Surfactant metabolism	digestion, proteolysis		multivesicular body lumen, extracellular exosome
ENSG00000229183	PGA4	-4.987947808370965	8.47847630025087e-28	-4.195347083333308	1.6598621960948458e-31	Metabolism of proteins, Surfactant metabolism	digestion, proteolysis	aspartic-type endopeptidase activity, protein binding	multivesicular body lumen, extracellular exosome
ENSG00000256713	PGA5	-4.987947808370965	8.47847630025087e-28	-4.195347083333308	1.6598621960948458e-31	Metabolism of proteins, Surfactant metabolism	digestion, proteolysis		multivesicular body lumen, extracellular exosome
ENSG00000096088	PGC	-4.015486258725803	8.113978604330971e-21	-3.9414394861110704	1.7284680040477325e-27		digestion, proteolysis, positive regulation of antibacterial peptide production	aspartic-type endopeptidase activity	extracellular space
ENSG00000139144	PIK3C2G	-1.4702402331451578	4.701529774205308e-23	-1.6421697083333138	2.34105468085796e-33	Metabolism, PI Metabolism, Synthesis of PIPs at the Golgi membrane, Phospholipid metabolism, Metabolism of lipids, Synthesis of PIPs at the plasma membrane	phosphatidylinositol 3-kinase signaling, cell migration, modulation by host of viral process, phosphorylation, phosphatidylinositol-3-phosphate biosynthetic process, chemotaxis	1-phosphatidylinositol-3-kinase activity, phosphatidylinositol kinase activity, 1-phosphatidylinositol-4-phosphate 3-kinase activity, phosphatidylinositol binding, ATP binding	cytosol, membrane, plasma membrane, phosphatidylinositol 3-kinase complex, cytoplasm
ENSG00000145287	PLAC8	-0.6028786806290327	0.0120197844429001	-1.134446652777754	1.1059010044795245e-07	Immune System, Innate Immune System, Neutrophil degranulation	negative regulation of multicellular organism growth, positive regulation of transcription by RNA polymerase II, negative regulation of apoptotic process, response to cold, brown fat cell differentiation, positive regulation of cold-induced thermogenesis, defense response to bacterium, transcription by RNA polymerase II, positive regulation of cell population proliferation		azurophil granule lumen, extracellular region
ENSG00000102934	PLLP	-0.4808808468790326	3.3167839434069525e-10	-0.778194208333316	3.6477103071840734e-31		myelination, monoatomic ion transport	structural constituent of myelin sheath, protein binding	membrane, compact myelin
ENSG00000110777	POU2AF1	-1.5300882583548407	4.1534358655666534e-08	-1.840851777777753	7.88703704129183e-16		positive regulation of transcription by RNA polymerase II, germinal center B cell differentiation, humoral immune response, DNA-templated transcription, cellular response to virus, positive regulation of interleukin-6 production	transcription coactivator activity, DNA binding, POU domain binding, protein binding, transcription coregulator activity	RNA polymerase II transcription regulator complex
ENSG00000166387	PPFIBP2	-0.7996819294516113	2.776256679374968e-09	-1.0177313194444313	1.03565813960334e-19	Neuronal System, Receptor-type tyrosine-protein phosphatases, Protein-protein interactions at synapses		molecular_function, protein binding, identical protein binding	presynaptic active zone, cytosol, extracellular space
